{
  "$schema": "http://json-schema.org/draft-07/schema#",
  "$id": "https://github.com/liatrio/arc/schemas/backlog-entry.schema.json",
  "title": "BacklogEntry",
  "description": "A single idea entry in docs/BACKLOG.md, parsed from a '## {Title}' section together with its summary-table row. Captures the captured | shaped | spec-ready lifecycle states (shipped ideas live in the wave archive, not BACKLOG). When status is 'shaped' or 'spec-ready', the brief fields required by references/brief-format.md MUST be present.",
  "type": "object",
  "required": ["title", "status", "priority", "captured"],
  "additionalProperties": false,
  "properties": {
    "title": {
      "type": "string",
      "minLength": 1,
      "description": "The idea title, matching the '## {Title}' heading and the BACKLOG summary-table row."
    },
    "status": {
      "type": "string",
      "enum": ["captured", "shaped", "spec-ready"],
      "description": "Current idea-lifecycle stage per references/idea-lifecycle.md. 'shipped' is intentionally excluded: shipped ideas are archived to docs/skill/arc/waves/ and removed from BACKLOG."
    },
    "priority": {
      "type": "string",
      "enum": ["P0-Critical", "P1-High", "P2-Medium", "P3-Low"],
      "description": "Priority label from the BACKLOG priority table."
    },
    "captured": {
      "type": "string",
      "format": "date-time",
      "description": "ISO 8601 timestamp when the idea was first captured."
    },
    "shaped": {
      "type": "string",
      "format": "date-time",
      "description": "ISO 8601 timestamp when /arc-shape completed shaping. Required when status is 'shaped' or 'spec-ready'."
    },
    "wave": {
      "type": "string",
      "minLength": 1,
      "description": "Wave assignment string, e.g. 'Wave 3 — Wave Lifecycle Closure'. Set by /arc-wave when the idea reaches spec-ready. For captured or summary-table rows with no assignment, the summary uses '--'."
    },
    "context": {
      "type": "string",
      "description": "Optional free-form 'Context:' note surfacing the idea's origin (e.g. 'Surfaced during /arc-assess on 2026-04-13')."
    },
    "summary": {
      "type": "string",
      "minLength": 1,
      "description": "The one-line summary captured at intake, rendered below the metadata list."
    },
    "brief": {
      "type": "object",
      "description": "Full spec-ready brief body; required when status is 'shaped' or 'spec-ready'. Fields follow references/brief-format.md.",
      "required": ["problem", "proposed_solution", "success_criteria", "constraints", "assumptions"],
      "additionalProperties": false,
      "properties": {
        "problem": { "type": "string", "minLength": 1 },
        "proposed_solution": { "type": "string", "minLength": 1 },
        "success_criteria": {
          "type": "array",
          "minItems": 3,
          "items": { "type": "string", "minLength": 1 }
        },
        "constraints": {
          "type": "array",
          "minItems": 1,
          "items": { "type": "string", "minLength": 1 }
        },
        "assumptions": {
          "type": "array",
          "minItems": 1,
          "items": { "type": "string", "minLength": 1 }
        },
        "open_questions": {
          "oneOf": [
            {
              "type": "array",
              "items": { "type": "string", "minLength": 1 },
              "description": "List of outstanding questions."
            },
            {
              "type": "string",
              "enum": ["None"],
              "description": "Literal 'None' when shaping resolved all questions."
            }
          ],
          "description": "Either an array of question strings or the literal string 'None'. Matches brief.schema.json."
        }
      }
    }
  },
  "allOf": [
    {
      "if": { "properties": { "status": { "const": "shaped" } }, "required": ["status"] },
      "then": { "required": ["title", "status", "priority", "captured", "shaped", "brief"] }
    },
    {
      "if": { "properties": { "status": { "const": "spec-ready" } }, "required": ["status"] },
      "then": { "required": ["title", "status", "priority", "captured", "shaped", "wave", "brief"] }
    }
  ]
}
